StructuredFormula,Perovskite_label
Ca2 (Mn Ta O6),1
(Sr1.5 La0.5) (Mn W O6),1
Sr2 Sm Nb O6,1
Nd2 Mg Ti O6,1
Sr2 Tb Ru O6,1
Sr2 Tb Ir O6,1
Ba0.4 Sr1.6 Y Os O6,1
Sr2 (Ni0.67 Sb1.33) O6,1
Ba0.2 Sr1.8 Y Os O6,1
(Ca Sr) Ni W O6,1
(Ca0.5 Sr1.5) Ni W O6,1
(Ca0.3 Sr1.7) Ni W O6,1
Sr2 Y Os O6,1
Ca2 (Mg Os) O6,1
(Ca La2 Ni2 W O9)1.333,1
La1.12 Li0.62 Ti2 O6,1
La1.04 Li0.86 Ti2 O6,1
Sr2 Y Ru O6,1
Sr2 (Fe Mo0.2 W0.8 O6),1
Sr2 (Fe W O6),1
Ca2 Fe Os O6,1
La Ba Co2 O6,1
(Ca Pr2 Ni2 W O9)1.333,1
Bi2 Ni Mn O6,1
(Sr1.25 La0.75) (Mn W O6),1
Sr2 (Mn W O6),1
(Ca Nd2 Ni2 W O9)1.333,1
Ba0.6 Sr1.4 Y Os O6,1
Ba1 Sr1 Y Os O6,1
Nd Pb Mg Sb O6,1
La1.5 Nd0.5 Li Sb O6,1
Pr Pb Mg Sb O6,1
La Pb Mg Sb O6,1
Ba2 La Bi O6,1
Sr2 (Lu Bi O6),1
(Ba0.5 Sr1.5) (Lu Bi O6),1
(Ba Sr) (Lu Bi O6),1
La Mg0.5 Ti0.5 O3,1
La0.9 (Mg0.35 Ti0.65) O3,1
Sr2 (Co U O6),1
La2 Li (Sb O6),1
(Ba Nd) Sb Ni O6,1
Ca2 (Ni Os O6),1
Sr Eu Li Te O6,1
Ba0.8 Sr1.2 Y Os O6,1
Ba2 Sr (U O6),1
Sr2 Ca (U O6),1
La2 (Co Ru O6),1
Ca2 (Co Te O6),1
Sr2 (Co Te O6),1
Bi2 Co Mn O6,1
La1.1 Sr0.9 Cu Ru O6,1
Sr2 (Ho Ru O6),1
(La0.5 Tb1.5) Co Mn O6,1
(La1.5 Tb0.5) Co Mn O6,1
La2 Co Mn O6,1
Sr2 Yb Sb O6,1
La (Mg0.5 Sn0.5) O3,1
Sr2 Yb Ta O6,1
Sr2 Yb Nb O6,1
Nd Ba Co Mn O5.62,1
Nd Ba Co1.5 Mn0.5 O5.60,1
Sr La Ni Ir O6,1
Sr La Mg Ir O6,1
Sr La Zn Ir O6,1
(Sr Ca) Y Ru O6,1
(Sr1.2 Ca0.8) Y Ru O6,1
(Sr1.4 Ca0.6) Y Ru O6,1
(Sr1.6 Ca0.4) Y Ru O6,1
(Sr1.8 Ca0.2) Y Ru O6,1
Sm2 Co Mn O6,1
Nd2 Co Mn O6,1
(Ba Pr) Co Ta O6,1
Sr2 Lu (Nb0.81 Ti0.19) O6,1
Sr2 Lu Nb O6,1
(La Tb) Co Mn O6,1
Sr2 Ni (Te O6),1
Sr2 (In Sb O6),1
Ca2 (Cr Sb O6),1
Sr2 (Y Sb O6),1
Nd Ba Co2 O6,1
Nd Ba Co2 O5.56,1
Pr2 Co Ti O6,1
La Pr Ni Mn O6,1
La Nd Ni Mn O6,1
La Sm Ni Mn O6,1
Y2 Ni Mn O6,1
Sr2 Lu Re O6,1
(La Sr2 Cr2 Sb O9)1.33,1
Ba2 La Ru O6,1
Ca2 Lu (Ru O6),1
Ca2 Mg (W O6),1
(La1.8 Ba0.2) Mg ((Ti0.9 W0.1) O6),1
(La1.5 Ba0.5) Mg ((Ti0.75 W0.25) O6),1
Ba2 Y0.879 U O6,1
(Y0.5 La0.5) Ba (Mn2 O6),1
Tb2 Co Mn O6,1
Ba2 Y Sb O6,1
Ba2 Sc Sb O6,1
Ba2 Lu Sb O6,1
Ba2 Yb Sb O6,1
Ba2 Gd Sb O6,1
Mn2 Fe Re O6,1
(Mn0.53 Ca0.47)2 Fe Re O6,1
(Ca Pr) Li (Te O6),1
Sr2 Er Sb O6,1
Sr2 Tm Sb O6,1
Sr2 Ca (W O6),1
(Ba0.2 Sr1.8) Ca (W O6),1
Ba2 Y (Re O6),1
(Ba0.4 Sr1.6) Ca (W O6),1
(Ba0.6 Sr1.4) Ca (W O6),1
Mg Ca2 (W O6),1
La2 Li (Ru O6),1
(Ba0.8 Sr1.2) Ca (W O6),1
(Ba Sr) Ca (W O6),1
La0.93 (Mg0.748 Nb0.352) O3,1
(Ba1.2 Sr0.8) Ca (W O6),1
(Ba1.4 Sr0.6) Ca (W O6),1
Pb2 (Mn Re O6),1
Sr2 (Mn Mo O6),1
Ca2 (Mn W O6),1
Sr2 Lu Sb O6,1
Sr2 Fe0.97 Mo0.94 O5.81,1
Ca2 (Fe0.94 Mo0.06) Mo O6.00,1
(Ba0.1 La0.9) (Mg0.633 Nb0.367) O3,1
Sr2 (Tb Ir O6),1
Mn2 Sc Sb O6,1
Sr2 Y Sb O6,1
(Sr Pr) Li (Te O6),1
Sr2 Ho Sb O6,1
(Pr0.5 Ba0.5) Co O3,1
(Pr0.6 Ba0.4) Co O3,1
(La0.9 Sr0.1) (Mg0.45 Ti0.55) O3,1
Lu2 Ni Mn O6,1
Sr2 (Tm Ta O6),1
Sr2 Pr Sb O6,1
Ba2 Nb (Ca0.733 Nb0.267) O5.9,1
Ba2 Nb (Ca0.787 Nb0.213) O5.823,1
Ba2 Nb (Ca0.833 Nb0.167) O5.75,1
Ba2 Nb (Ca0.9 Nb0.1) O5.65,1
La (Li0.333 Ti0.667) O3,1
La2 Co (Ti O6),1
La2 Ni (Ti O6),1
La (Mg0.5 Ti0.5) O3,1
(La0.9 Ba0.1) (Mg0.45 Ti0.55) O3,1
La2 Ni (Ru O6),1
Sr2 Nd Sb O6,1
Nd Ba Co2 O5.51,1
Sr2 Sm Sb O6,1
Sr2 Eu Sb O6,1
Sr2 Gd Sb O6,1
Sr2 Dy Sb O6,1
Sr2 (Ce Ir O6),1
La (Mg0.667 Nb0.333) O3,1
La (Mg0.6 Nb0.4) O3,1
Ca2 Ho Nb O6,1
Sr2 Co Ir O6,1
Ba2 Pr Ru O6,1
Sr La Mn Ta O6,1
Ca2 (Fe Re O6),1
Sr2 Fe Ir O6,1
Sr2 Sc Ir O6,1
Ca2 (Fe Mo O6),1
Sr2 In Ir O6,1
La0.587 Li0.24 Ti O3,1
Sr2 Ho (Sb O6),1
Sr2 Dy (Sb O6),1
Sr2 (Co0.5 Mg0.5) Te O6,1
Sr2 (Co0.8 Mg0.2) Te O6,1
Sr2 (Co0.9 Mg0.1) Te O6,1
Sr2 Co Te O6,1
(La Ca) (Mn Nb O6),1
La2 (Ir Zn O6),1
Ca2 Er Nb O6,1
Ca2 Lu Nb O6,1
(La1.2 Ca0.8) ((Co Ir) O6),1
Ca2 (Ni W O6),1
La2 Ni Ru O6,1
Sr La Cu Ru O6,1
Sr La Ni Ru O6,1
Nd Ba Co2 O5.76,1
Sm2 (Mn Ti O6),1
La2 (Ni Mn O6),1
La2 (Co Mn O6),1
(La0.622 Li0.378) (Ti O3),1
(Ca0.333 La0.667) (Ti0.667 Ca0.333) O3,1
Ca2 (Co W O6),1
(La Ca) ((Co Ir) O6),1
(La1.5 Ca0.5) ((Co Ir) O6),1
La2 (Co Ir O6),1
Sr La Mn Mo O6,1
Ba2 Lu Ir O6,1
Sr2 Lu Ir O6,1
Ba2 La Ir O6,1
Ba2 Y Ir O6,1
Sr2 Y Ir O6,1
Ba2 Sc Ir O6,1
(La1.8 Ca0.2) ((Co Ir) O6),1
Sr2 Lu (Nb0.9 Ti0.1) O6,1
Sr1.97 Lu (Nb0.90 Ti0.1) O5.91,1
Nd Pb Co Sb O6,1
La2 Li Re O6,1
Sr2 Mg (Mo O6),1
Sr2 Mg (Mo0.8 W0.2 O6),1
Sr2 Mg (Mo0.6 W0.4 O6),1
Sr2 Mg (Mo0.4 W0.6 O6),1
Sr2 Mg (Mo0.2 W0.8 O6),1
Sr2 Mg (W O6),1
Sr2 Mg (Mo0.9 Nb0.1 O6),1
Sr2 Mg (Mo0.8 Nb0.2 O6),1
Sr2 Mg (Mo0.7 Nb0.3 O6),1
Sr2 Mg (Mo0.6 Nb0.4 O6),1
Sr2 Mg (Mo0.5 Nb0.5 O6),1
Pb2 Mg (U O6),1
(Ca1.9 Ce0.1) (Fe Mo O6),1
(Ca1.8 Ce0.2) (Fe Mo O6),1
(Ca1.7 Ce0.3) (Fe Mo O6),1
(Ca1.6 Ce0.4) (Fe Mo O6),1
Ho2 Mn Ni O6,1
Mn2 (Fe Sb O6),1
Ca2 La Sb O6,1
Ca1.5 Sr0.5 La Sb O6,1
Ca Sr La Sb O6,1
Ca1.5 Sr0.5 Sm Sb O6,1
Pb2 Ca (U O6),1
Pb2 Cd (U O6),1
Nd2 (Mg Ir O6),1
La2 Na Ir O6,1
Eu2 Mg Ir O6,1
Ca La Ni Ru O6,1
Sr2 (In0.98 Re1.03) O6,1
La2 Li Os O6,1
Nd2 Li Os O6,1
Sm2 Li Os O6,1
Sr2 (Fe Sb O6),1
Sr2 (In0.97 Re1.03) O6,1
La2 Li Ir O6,1
Eu2 Ir Li O6,1
Sm2 Li Ir O6,1
Nd2 Li (Ir O6),1
Pr2 Li Ir O6,1
Pr2 Na Ru O6,1
Sr2 Mg (U O6),1
Sr2 Cd (U O6),1
Nd2 Na Ru O6,1
La2 Na Ru O6,1
Nd2 Na Ir O6,1
Pr2 Na Ir O6,1
Ca Sr Sm Sb O6,1
Ba2 (Mn Te O6),1
Ca2 Mn Re O6,1
(Sr1.72 La0.28) Co (W0.93 Co0.07) O6,1
Sr1.6 Nd0.4 Fe Mo O6,1
Ca2 (Fe1.3 W0.7) O6,1
Ca2 Al Nb O6,1
Ca2 Cr Ta O6,1
Ca2 Fe (Fe0.23 W0.77) O6,1
Ca2 Fe (Fe0.2 W0.8) O6,1
Sr2 Sc Nb O6,1
Sr2 (In0.97 W0.03) (In0.37 W0.63) O6,1
Sr2 Mg Te O6,1
Ba2 La Nb O6,1
Ba2 Nd Nb O6,1
Sr2 In (In0.333 U0.667) O6,1
Ba2 La Ta O6,1
Ca2 Cr Sb O6,1
Sr2 Cr Sb O6,1
Sr2 Fe Ta O6,1
(Sr0.9 La0.1)2 Fe Ta O6,1
(Sr0.8 La0.2)2 Fe Ta O6,1
(Sr0.7 La0.3)2 Fe Ta O6,1
La Co0.50 Ti0.50 O3,1
Sr2 Mg Mo O6,1
Na La Sc Sb O6,1
Sr2 Eu Mo O6,1
Ca2 ((Ca0.08 In0.88 Nb0.04) Nb) O6,1
Ca1.6 La0.4 Fe Re O6,1
(Sr1.32 La0.68) Co (W0.83 Co0.17) O6,1
(Sr0.91 La1.09) Co (W0.73 Co0.27) O6,1
(Sr0.33 La1.67) Co (W0.58 Co0.42) O6,1
La2 Na Os O6,1
Pr2 Na Os O6,1
Nd2 Na Os O6,1
Sr2 Y Ta O6,1
Sr2 Y Nb O6,1
La4 (Co2.667 Ta1.333) O12,1
La4 (Co2.667 Nb1.333) O12,1
Ca1.8 La0.2 Fe Re O6,1
Sr2 In Nb O6,1
Ca2 Fe Re O6,1
Sr (Nb0.5 Yb0.5) O3,1
Ca2 Sc Os O6,1
(Sr1.7 La0.3) (Cr Mo) O6,1
Sr2 Yb Mo O6,1
Sr2 Er Mo O6,1
Sr2 Ho Mo O6,1
Sr2 Dy Mo O6,1
Sr2 Gd Mo O6,1
Gd2 (Mg Ir O6),1
Sr2 Mn (W O6),1
Pr Pb Co Sb O6,1
La (Nb0.33 Ni0.67) O3,1
Sr2 (Co Ir) O6,1
Sm Ba (Co1.2 Fe0.8) O6,1
Sm Ba (Co1.8 Fe0.2) O6,1
(Co Ti) La2 O6,1
(La Sr) Zn Ru O6,1
(La Sr) Mg Ru O6,1
Ca2 (Mn Sb O6),1
Sr2 In Ta O6,1
Eu3 Nb O6,1
Eu2 Ho Ta O6,1
Ca2 Ho (Ta O6),1
Ca2 Gd (Ta O6),1
Sr2 Mn Mo O6,1
Sr Nd Ni Ru O6,1
Sr Nd Mg Ru O6,1
Sr Nd Co Ru O6,1
Sr Nd Zn Ru O6,1
Sm2 Ni Mn O6,1
Nd2 Ni Mn O6,1
La2 Ni Ti O6,1
Ca Sr2 (W O6),1
(Ba0.8 Sr1.2) In Ta O6,1
Pr2 (Mg Ir O6),1
(Ba0.6 Sr1.4) In Ta O6,1
La Pb Co Sb O6,1
La Pb Ni Sb O6,1
(Ba La) (Ni Sb) O6,1
(Ba La) (Mn Sb) O6,1
Nd2 Mg Ru O6,1
Sm Ba Co1.3 Cu0.7 O6,1
Sm Ba Co1.9 Cu0.1 O6,1
Ca2 (Mn1.33 W0.67) O6,1
Ba2 (Bi2 O6),1
La2 Zn Mn O6,1
Ba2 (Nd Nb O6),1
Sr2 Zn W O6,1
Ca2 In Os O6,1
Y ((Co0.48 Mn0.52) O3),1
Sr2 Mg Ir O5.89,1
Sr2 Ca Ir O6,1
(Ba0.2 Sr1.8) In Ta O6,1
(Ba0.4 Sr1.6) In Ta O6,1
Ba2 Ce Sb O6,1
La2 Ni (Mn0.2 Ti0.8) O6,1
La2 Ni (Mn0.4 Ti0.6) O6,1
La2 Ni (Mn0.6 Ti0.4) O6,1
(Bi0.25 La1.75) ((Mn1.06 Co0.94) O6),1
(Bi0.5 La1.5) ((Mn1.05 Co0.95) O6),1
La2 Ni1.333 Sb0.667 O6,1
La2 Ni Co0.333 Sb0.667 O6,1
(Ba1.25 Sr0.75) Ca W O6,1
La2 Ni0.667 Co0.667 Sb0.667 O6,1
La2 Ni0.333 Co Sb0.667 O6,1
(Ba1.35 Sr0.65) Y Sb O6,1
Sr (Ca Nd) (Ru O6),1
Sm2 (Ni Mn O6),1
Tb2 (Ni Mn O6),1
Mn2 (Mo1.27 Fe0.73) O6,1
La Ca Ni Os O6,1
La Ca Co Os O6,1
Sr La Ni Os O6,1
Sr La Co Os O6,1
Sm2 (Mg Ir O6),1
Nd ((Mg Sn)0.5 O3),1
(La0.25 Nd0.75) ((Mg Sn)0.5 O3),1
Sr La Mg Ta O6,1
La2 Ni (Mn0.8 Ti0.2) O6,1
La2 Na (Ta O6),1
La2 Ni Mn O6,1
Y2 Al Cr O6,1
(K0.50 Na0.50) (Nb O3),1
Ca2 Ni (W O6),1
Ba2 Ce Ta O6,1
Ba2 Ce Nb O6,1
Ca La Mg Ta O6,1
(La0.5 Nd0.5) ((Mg Sn)0.5 O3),1
La2 Mg1.33 Ta0.67 O6,1
Ba2 Bi2 O6,1
Sr2 Sc Sb O6,1
Ca2 Sc Sb O6,1
Sr La (Mn1.05 Sb0.95 O6),1
Nd Ba (Mn Co) O6,1
La ((Mg Sn)0.5 O3),1
(La0.75 Nd0.25) ((Mg Sn)0.5 O3),1
Sr2 (Tb Ru O6),1
(La0.9 Ca0.1) (Mg0.45 Ti0.55) O3,1
Ba1.2 La0.8 Mn Sb O6,1
Sr2 Zn Mo O6,1
Ca2 (In Sb O6),1
(K0.5 Na0.5) (Nb O3),1
Sr2 Fe Mo O6,1
Sr2 Co Mo O6,1
Sr2 Ni Mo O6,1
Cr Mn2 Sb O6,1
Ba0.2 Sr1.8 Y Ir O6,1
Dy2 Ni Mn O6,1
Ca2 Co Nb O6,1
Sr2 In Os O6,1
Sm2 Na Ir O6,1
(Ca1.5 La0.5) Fe (Mo0.7 W0.3) O6,1
(Ca1.5 La0.5) Fe (Mo0.9 W0.1) O6,1
(Ca1.5 La0.5) Fe Mo O6,1
Sr2 Lu Ru O6,1
Sr2 Cd W O6,1
Sr La Mg Re O6,1
Sr La Mn Re O6,1
Ba (Tb0.667 W0.333) O3,1
Ba0.6 Sr1.4 Y Ir O6,1
Ba0.8 Sr1.2 Y Ir O6,1
Sr2 Mn Re O5.8,1
Ba Sr Y Ir O6,1
(Ba1.5 Sr0.5) Nd Ir O6,1
La (Co0.67 Nb0.33) O3,1
Ba2 Bi Sb O6,1
Tm2 Ni Mn O6,1
Sr2 Ti Mo O6,1
Er2 Ni Mn O6,1
Ho2 Ni Mn O6,1
Y2 Mg Ti O6,1
Tb2 Ni Mn O6,1
Ba La Cu Sb O6,1
Sr La Ni Re O6,1
(La Sr) ((Co Ru) O6),1
Ba2 Pr (Ru0.8 Ir0.2) O6,1
Sr2 (Tm Ru O6),1
Sr La Co Re O6,1
Ca2 Ho Ta O6,1
Sr2 Ho Ta O6,1
Nd Ba (Co1.6 Cu0.4) O5.534,1
Ho Ba (Co1.9 Fe0.1) O6,1
Ho Ba (Co1.6 Fe0.4) O6,1
Ho Ba (Co1.7 Fe0.3) O6,1
Ho Ba (Co1.8 Fe0.2) O6,1
Ho Ba Co2 O6,1
Sr2 Eu Ru O6,1
Sr2 Gd Ru O6,1
Sr2 Dy Ru O6,1
Sr2 Ho Ru O6,1
Sr2 Er (Ru O6),1
(Sr Pr) Mg Ru O6,1
(Sr Pr) Co Ru O6,1
(Sr Pr) Zn Ru O6,1
(Sr La) (Ni Sb) O6,1
La2 Li Sb O6,1
Ba2 Ru0.67 Bi1.33 O6,1
La Ba Co2 O5.77,1
Ba2 La (Ru0.5 Sb0.5) O6,1
(Sr La) Cu Sb O6,1
Nd Ba (Co1.8 Cu0.2) O5.666,1
Nd Ba (Co1.5 Ni0.5) O5.556,1
Nd Ba (Co1.6 Ni0.4) O5.587,1
Nd Ba (Co1.7 Ni0.3) O5.602,1
Nd Ba (Co1.8 Ni0.2) O5.624,1
Ba.96 K.04 Bi O3,1
Nd Ba (Co1.9 Ni0.1) O5.65,1
Nd Ba Co2 O5.67,1
(La Sr) (Mn Nb) O6,1
Ba Bi O3,1
In2 Ni Mn O6,1
Pr Ba Co2 O6,1
Ba La Mn Mo O6,1
Sr2 Bi Nd O6,1
Ca2 (Mn1.33 Sb0.67) O6,1
Y2 Co Mn O6,1
Ca2 (Fe Re) O6,1
(Sr Pr) Ni Ru O6,1
Ba0.4 Sr1.6 Y Ir O6,1
(Ca1.8 Sr0.2) (Fe Mo O6),1
Pb1.87 Ni Re O6,1
(Sr Ca) (Cr0.48 Nb0.52) (Cr0.52 Nb0.48) O6,1
Ca2 (Cr0.76 Nb0.24) (Cr0.24 Nb0.76) O6,1
La2 Li Ta O6,1
(Ca La) Mn Mo O5.92,1
Pr2 Ni Zr O6,1
Sr2 Sc Os O6,1
(Pr0.9 Y0.1) Ba Co2 O6,1
(Sr1.94 La0.062) Co (W0.984 Co0.016) O6,1
Ca2 Mn W O6,1
(Sr1.86 La0.14) Co (W0.964 Co0.036) O6,1
(Sr1.82 La0.18) Co (W0.956 Co0.044) O6,1
Ba2 Sr U O6,1
La0.5 Ba0.5 (Mn O3),1
La0.48 Ba0.52 (Mn O3),1
La0.52 Ba0.48 (Mn O3),1
(Nd0.864 Ca0.136) (Sn0.575 Ca0.425) O3,1
(Nd0.702 Ca0.298) (Sn0.635 Ca0.365) O3,1
Lu2 Ni Ir O6,1
Ba0.48 Ca0.51 Ti0.84 Sn0.16 O3,1
Ba2 Sr W O6,1
Ba2 Ca U O6,1
(Ba0.7 Sr0.3)2 Pr Ru O6,1
Sr2 (Co Sb) O6,1
Ca Sr2 (Te O6),1
Ca Sr2 (Mo O6),1
Sm Ba Co2 O6,1
Sr2 Cd (W O6),1
Ca2 Mn0.001 Y0.999 Sb O6,1
Ba2 Pr (Sn0.4 Sb0.6) O5.98,1
Y (Mn Co)0.5 O2.87,1
Ba2 (Pr Nb O6),1
Ba2 Pr (Sn0.2 Nb0.8) O6,1
Ba2 Sr (W O6),1
Sr2 Co (W O6),1
Sr2 Zn U O6,1
Sr2 Ni U O6,1
Sr2 (Ni0.9 Mg0.1) Te O6,1
Ba Bi0.5 Sb0.5 O3,1
Ca2 Cr Os O6,1
Ca2 (Al Ta O6),1
Sr2 Ni Te O6,1
La Ca Co Nb O6,1
Ca ((Fe0.5 Nb0.5) O3),1
(Na0.667 Th0.334) (Ti O3),1
La Sr Co Nb O6,1
Sr2 (Cr Sb) O6,1
(Sr3 Co Sb2 O9)1.333,1
Sr Ca Ni Te O6,1
Sr Ca Co Te O6,1
Sr2 La Sb O6,1
(Bi0.5 Pb0.5) (Fe0.52 Zr0.48) O3,1
Nd0.96 Ba Co2 O6,1
Sr2 (Ni0.8 Mg0.2) Te O6,1
Sr2 Fe U O6,1
Sr2 (Ni0.7 Mg0.3) Te O6,1
Sr2 Mn U O6,1
Sr2 Er (Mo O6),1
(Ba0.25 Sr1.75) Er (Mo O6),1
(Ba0.75 Sr1.25) Er (Mo O6),1
Sr2 (Ni0.5 Mg0.5) Te O6,1
(Ca1.7 Sr0.3) (Fe Mo O6),1
(Ba La) Co Ir O6,1
Ba2 La (Sb O6),1
Nd2 (Co Mn O6),1
(Ba0.3 Ca0.7 La) Ca Nb O6,1
La2 Li Nb O6,1
Ba3 Ca Nb2 O9,1
(Ca1.9 Sr0.1) (Fe Mo O6),1
La Sr Zn Sb O6,1
La0.597 Li0.21 Ti O3,1
La0.557 Li0.33 Ti O3,1
La (Ba0.2 Sr0.8) Zn Sb O6,1
La (Ba0.4 Sr0.6) Zn Sb O6,1
La (Ba0.6 Sr0.4) Zn Sb O6,1
La (Ba0.8 Sr0.2) Zn Sb O6,1
Sr1.4 Ba0.6 Ho Ru O6,1
Sr1.6 Ba0.4 Ho Ru O6,1
Sr1.8 Ba0.2 Ho Ru O6,1
(Ba1.375 Sr0.625) (Lu Bi O6),1
La2 Li (Mo O6),1
Y (Ni0.5 Mn0.5 O3),1
La Ba Zn Sb O6,1
Ca2 Fe (Sb O6),1
Ca2 (Cr Nb O6),1
Nd1.96 (Co Mn)0.98 O6,1
La1.92 (Co0.333 Nb0.667) Co O6,1
Sr2 ((Co1.1 Sb0.9) O6),1
Sr2 ((Co0.8 Sb1.2) O6),1
Sc2 Ni Mn O6,1
Pr2 (Zn Ti) O6,1
Ba2 Pr Bi O6,1
Ba2 Nd Bi O6,1
Ba2 Tb Bi O6,1
Gd2 (Zn Ti) O6,1
Ce K Fe Mo O6,1
Ca Sm Mg (Nb O6),1
(La3 Co2 Ta O9)1.333,1
La1.93 (Co0.333 Nb0.667) (Co0.667 Mg0.333) O6,1
La2 (Co0.5 Nb0.5) (Co0.5 Mg0.5) O6,1
La2 (Mn V O6),1
(La0.7 Ca0.3) ((Co0.5 Mn0.5) O3),1
La2 (Ni Ru O6),1
Y ((Mn0.5 Ni0.5) O3),1
Nd ((Mn0.5 Ni0.5) O3),1
La0.93 ((Mn0.5 Ni0.5) O3),1
Nd Ba (Mn2 O6),1
Pr Ba (Mn2 O6),1
La1.92 (Co0.333 Nb0.667) (Co0.867 Mg0.133) O6,1
(La1.4 Ca0.6) (Co Mn O6),1
La Sr Co Ru O6,1
(Pr0.487 Bi0.013) (Bi0.254 Pr0.246) Sr O2.964,1
(Sr1.2 La0.8) Fe Ir O6,1
(La1.12 Li0.62) (Ti2 O6),1
Ba2 Pr Nb O6,1
Na2 (Sn Te O6),1
La (Mg0.598 Nb0.402) O3,1
Sr2 Fe W O5.8 N0.2,1
Ba2 La U O6,1
Ba2 Nd U O6,1
Ba2 Sm U O6,1
Sr2 Sc Ru O6,1
Sr2 Sb (Sb0.4 Ca0.6) O6,1
Ba2 La (Ru O6),1
La (Mg0.6326 Nb0.3679) O3,1
Ba1.1 La0.9 Mn Sb O6,1
(K0.667 Th0.333) (Ti O3),1
La2 Zn (Rh O6),1
La2 Mg (Rh O6),1
Ba ((Ce0.1 Bi0.9) O3),1
La2 Mg (Pt O6),1
La2 Ni (Pt O6),1
La2 Zn (Pt O6),1
La2 Co (Pt O6),1
Pr2 Co (Pt O6),1
Nd2 Co (Pt O6),1
Mn2 Mn Re O6,1
Sr Bi O3,1
(Li0.19 La0.667) ((Ti0.9 Co0.095) O3),1
Mn2 (Mn0.947 Re0.053) Re O6,1
La1.98 (Mn1.11 Mo0.89) O5.93,1
Nd Ba Fe2 O5.5,1
La1.92 (Mn1.29 Mo0.71) O5.84,1
Sr2 (Bi1.4 Ca0.6) O6,1
Sr2 Bi Lu O6,1
Sm Ba Fe2 O5.498,1
Sm Ba Fe2 O5.582,1
Sr2 Mg Mo O5.97,1
Sr Ca Cr Sb O6,1
Ca La Mn Mo O6,1
(La1.05 K0.95) (Fe0.9 Co0.1) (Mo O6),1
(Ba La) (Co Ru O6),1
(Sr La) (Co Ru O6),1
La2 Ni1.333 Sb0.5 Nb0.167 O6,1
Mn2 V Sb O6,1
La2 Ni1.333 Ta0.5 Nb0.167 O6,1
(La1.2 Sr0.8) (Co1.2 Ru0.8) O6,1
(La Sr) (Co Ru) O6,1
Ca2 (Cr Ta) O6,1
(La0.8 Sr1.2) (Co0.8 Ru1.2) O6,1
La2 Ni1.333 Sb0.5 Ta0.167 O6,1
Sr1.5 Ca0.5 Cr Sb O6,1
(La K) (Fe0.9 Co0.1) (Mo O6),1
(La K) (Fe0.8 Co0.2) (Mo O6),1
(La1.1 K0.9) (Fe0.8 Co0.2) (Mo O6),1
Ba2 Sr (Ir O6),1
Gd Ba (Co Fe) O6,1
Y Ba Co2 O6,1
Sr2 Ca (Ir O6),1
Nd Ba (Co1.5 Fe0.5) O6,1
Sr4 (Sb2.662 Ni1.338) O12,1
(La1.67 Pb0.33) (Mn0.97 Co0.91 Pt0.12) O6,1
La2 (Ir Ni O6),1
Nd Ba (Co Fe) O6,1
Pb2 Co (W O6),1
Sr2 Zn Ir O5.87,1
Gd Ba (Co1.5 Fe0.5) O5.98,1
Nd Ba Co2 O5.85,1
Sr2 Ni Ir O6,1
La2 (Mg Ir O6),1
Ca (Co0.28 Mg0.72) (C O3)2,0
(Sr0.977 Li0.016 Eu0.016)2 Zn (W0.8 Mo0.2) O6,0
Ba2 Tb (Sn0.3 Nb0.7) O6,0
Ba2 Tb (Sn0.6 Nb0.4) O6,0
Ba2 Zn Os O6,0
Ba2 (Fe Re) O6,0
Y (In0.492 Mn0.508) O3,0
(Sr0.95 Li0.025 Eu0.025)2 Zn W O6,0
(Sr0.956 Li0.021 Eu0.021)2 Zn (W0.6 Mo0.4) O6,0
Ca Mg (C O3)2,0
K Na (V O3)2,0
Na2 (U O2) Ge O4,0
(Sr0.96 Li0.02 Eu0.02)2 Zn (W0.4 Mo0.6) O6,0
Ba2 Mg Os O6,0
(Sr0.95 Li0.025 Eu0.025)2 Zn (W0.2 Mo0.8) O6,0
Y Ba (Mn2 O6),0
Ca (Co0.19 Mg0.81) (C O3)2,0
(Sr0.95 Li0.024 Eu0.024)2 Zn Mo O6,0
Ba2 Fe (Mo O6),0
Ca (Co0.25 Mg0.75) (C O3)2,0
Li Al (Si2 O6),0
Ba2 (Tb Nb O6),0
Ba Mg (C O3)2,0
Li2 (Mo O3) (Te O3),0
Nd Ba Mn2 O5.89,0
Ba2 Pr Sb O6,0
Ba2 Ca Te O6,0
Na Fe Si2 O6,0
Na0.86 Mg0.71 Ti0.433 Si2 O6,0
Ba1.7 La0.3 Mn Sb O6,0
Ba1.6 La0.4 Mn Sb O6,0
Li2 (W O3) (Te O3),0
Ba2 Ca W O6,0
K (B Ge2 O6),0
Bi Pb2 V O6,0
Ba1.5 La0.5 Mn Sb O6,0
Ba2 Sr Te O6,0
Ba1.4 La0.6 Mn Sb O6,0
Ba2 (Tb Sb) O6,0
Ba2 (Sc0.85 Ru0.15) Ru O6,0
Na2 (Nb O2) (As O4),0
Ba2 Sc Os O6,0
Ag Cs (N O3)2,0
Ba2 In Os O6,0
Ba2 Pr (Sn0.7 Nb0.3) O6,0
Ba2 Y Os O6,0
Na0.1 Li0.9 Fe Ge2 O6,0
Ba2 Pr (Sn0.6 Nb0.4) O6,0
Pb2 (Hg O2) (Cr O4),0
(Mg0.91 Fe0.09) Ca (Si O3)2,0
Sr2 (Cr Re) O6,0
(Sr1.74 Y0.26) (Cr Re) O6,0
Sr Zn (Se O3)2,0
Sr Mn (Se O3)2,0
La2 Cu Ir O6,0
Sr (Fe0.67 Te0.33) O3,0
Sr2 Sc Mo O6,0
Ba2 Cd Os O6,0
Ba1.4 Sr0.6 Y Os O6,0
Ba Hf (B O3)2,0
Na In (Te O3)2,0
(Sr1.75 Eu0.25) Fe Mo O6,0
Pb2 Mn W O6,0
Sr2 (Co Ir) O5.8,0
Al3.84 Ca0.04 Mg0.16 Na3.96 O24 Si8,0
Al0.145 Ca0.11 Mg0.355 Na0.39 O3 Si,0
Pb2 Tm (Sb O6),0
Ba Cu Si2 O6,0
(Ca0.56 Na0.44) (Fe0.49 Mg0.51) (Si2 O6),0
(Ca0.67 Na0.33) (Fe0.38 Mg0.63) (Si2 O6),0
(Ca0.88 Na0.12) (Fe0.18 Mg0.82) (Si2 O6),0
(Ca0.94 Na0.06) (Fe0.08 Mg0.92) (Si2 O6),0
(Ca0.56 Na0.44) (Fe0.44 Mg0.56) (Si2 O6),0
Pb2 Bi V O6,0
(Ca0.5 Na0.5) (Fe0.5 Mg0.5) (Si2 O6),0
(Ca0.8 Fe0.2) (Mg0.8 Fe0.2) Si2 O6,0
(Ba1.20 Ca0.80) La Nb O6,0
(Ba1.75 Sr0.25) Nd Ir O6,0
Ba2 Nd Ir O6,0
(Sr1.80 Eu0.20) Fe Mo O6,0
Ba2 In Ta O6,0
(Ca0.36 Na0.64) (Fe0.68 Mg0.32) (Si2 O6),0
Li Fe (H P O3)2,0
K In (Te O3)2,0
Ba2 Ca Mo O6,0
Ba2 (In Sb O6),0
Ba2 Mg W O6,0
Sr2 Fe Mo N0.92 O5.04,0
Pb (Mg0.5 W0.5) O3,0
(Sr1.95 Eu0.05) Fe Mo O6,0
Li Mn2 Te O6,0
Sr Co0.5 Re0.5 O3,0
(Sr1.90 Eu0.10) Fe Mo O6,0
Na Fe (Si2 O6),0
(Ca0.31 Na0.69) (Fe0.76 Mg0.24) (Si2 O6),0
(Sr1.85 Eu0.15) Fe Mo O6,0
(Ba1.60 Ca0.40) La Nb O6,0
Al0.31 Ca0.19 Mg0.19 Na0.31 O3 Si,0
Na0.2 Li0.8 Fe Ge2 O6,0
La2.01 Co0.98 Mn0.49 Ru0.52 O6,0
Ca (Co0.1 Mg0.9) (C O3)2,0
Ca (Co0.13 Mg0.87) (C O3)2,0
Ba1.3 La0.7 Mn Sb O6,0
Ba (Mg0.475 Yb0.025) (W0.491 Yb0.009) O3,0
Ba (Mg0.475 Y0.025) (W0.491 Y0.009) O3,0
Ba (Mg0.475 Dy0.025) (W0.491 Dy0.009) O3,0
Ba (Mg0.475 Sm0.025) (W0.491 Sm0.009) O3,0
Gd2 Co Mn O6,0
Sr2 Mg Re O6,0
Ba1.2 Sr0.8 Y Os O6,0
La2 Li Fe O6,0
Ba1.6 Sr0.4 Y Os O6,0
Na0.9 Li0.1 Fe Ge2 O6,0
Na0.7 Li0.3 Fe Ge2 O6,0
Ba1.8 Sr0.2 Y Os O6,0
Na0.5 Li0.5 Fe Ge2 O6,0
Ca Mg0.98 (C O3)2,0
Na Cr (Ge2 O6),0
Cs2 (U O2) Ge O4,0
Li Cr (Ge2 O6),0
Gd Ba Mn Fe O6,0
Ca (Co0.69 Mg0.31) Si2 O6,0
Ca Co Si2 O6,0
Ca0.9 Co1.1 Si2 O6,0
Al0.22 Ca0.30 Mg0.28 Na0.20 O3 Si,0
Ba2 Ni Os O6,0
Ca0.499 Na.001 Fe0.015 Mg0.485 O3 Si,0
(Sr1.70 Eu0.30) Fe Mo O6,0
Ba2 (Nd0.96 Y0.04) Mo O6,0
Ba2 (Nd0.9 Y0.1) Mo O6,0
La2.00 Co1.02 Ru0.98 O6,0
La1.99 Co1.01 Mn0.27 Ru0.73 O6,0
Ba (Ir0.51 Ni0.49) O3,0
K2 (U O2) Ge O4,0
(Ca0.76 Na0.24) (Fe0.23 Mg0.77) (Si2 O6),0
Rb (B2 Nb O6),0
Na Ti (Si2 O6),0
(Sr1.9 Gd0.1) Fe Mo O6,0
Ba2 (U Cu O6),0
(Na0.54 Ca0.46) (Ti0.54 Mg0.46)  (Si2 O6),0
Sr2 Zr Mn O6,0
(Mg0.845 Fe.048 Al0.083 Ti0.002 Cr0.023) (Ca0.828 Na0.102 Mg0.045 Fe0.024 Mn0.001) ((Si0.981 Al0.019)2 O6),0
(Mg0.765 Al0.138 Fe0.045 Ti0.008 Cr0.044) (Ca0.645 Na0.094 Mg0.192 Fe0.067 Mn.002) (Si1.888 Al0.112 O6),0
Ba Ca (C O3)2,0
Sr2 Y (Sb O6),0
Sr2 (Cr Ta O6),0
Ba2 Pr Ir O6,0
Ca2 (Ni W O5.75),0
Sr2 ((Fe0.1 Co0.9) Mo O6),0
Sr2 ((Fe0.3 Co0.7) Mo O6),0
Sr2 ((Fe0.6 Co0.4) Mo O6),0
Sr2 ((Fe0.8 Co0.2) Mo O6),0
Sr2 ((Fe0.9 Co0.1) Mo O6),0
Sr2 ((Fe0.95 Co0.05) Mo O6),0
Sr2 (Fe Mo O6),0
K Na (V2 O6),0
(Ba1.625 Sr0.375) (Lu Bi O6),0
Li Cu2 (V O4) (O H)2,0
(La1.6 Sr0.4) (Co Mn O6),0
Sr2 (Fe0.9 Cr0.1) Mo O6,0
(Sr1.95 Gd0.05) Fe Mo O6,0
(Sr1.85 Gd0.15) Fe Mo O6,0
(Sr0.2 Ba0.8)2 Ca Mo O6,0
(Sr1.8 Gd0.2) Fe Mo O6,0
(Sr0.6 Ba0.4)2 Ca Mo O6,0
(Sr0.8 Ba0.2)2 Ca Mo O6,0
(Na0.5 Bi0.5) (Ti O3),0
Sr2 Zn (Mo O6),0
Sr1.99 (Fe0.96 Mo1.04) O6,0
Sr1.90 (Fe1.04 Mo0.96) O6,0
Sr1.85 (Fe1.14 Mo0.86) O6,0
Sr1.87 (Fe1.12 Mo0.88) O6,0
Sr1.96 (Fe1.08 Mo0.92) O6,0
Ba Ti (B O3)2,0
(Sr1.081 K0.887) (Fe Mo0.979) O6,0
(Mg (H O3 P C H (O H) C O2)),0
Ba2 Tb Ir O6,0
Sr2 Fe (Mo0.7 Ta0.3) O6,0
Sr2 Fe (Mo0.9 W0.1) O6,0
Sr2 Fe (Mo0.7 W0.3) O6,0
Sr2 ((Fe Mo) O6),0
(Sr1.75 Gd0.25) Fe Mo O6,0
Ba2 (Zn0.9 W0.1) W0.95 O6,0
Ba1.93 Ni W0.96 O6,0
(Nd0.15 Sr0.83) (Al0.6 Nb0.42) O3,0
Sr2 (Fe0.94 Mo0.05) ((Mo0.94 Fe0.05) O6),0
Sr2 (Fe0.60 Mn0.25 Mo0.15) ((Mo0.85 Fe0.15) O6),0
Sr2 (Fe0.69 Cr0.09 Mo0.22) ((Mo0.78 Fe0.06 Cr0.16) O5.9),0
Sr2 (Fe0.56 V0.14 Mo0.30) ((Mo0.70 Fe0.19 V0.11) O6),0
Sr2 (Fe0.45 Ti0.19 Mo0.34) ((Mo0.64 Fe0.29 Ti0.06) O6),0
Sr2 (Fe0.62 Sc0.25 Mo0.11) ((Mo0.87 Fe0.11) O5.96),0
Ba2 (Mn Mo O6),0
Ba2 (Fe Mo O6),0
Ba2 (Fe W0.5 Mo0.5 O6),0
(Mg2.2 Fe0.63) H2.79 (Si0.73 O6),0
Sr2 Ga Mn O5.52,0
Ba2 Fe Mo O6,0
Sr2 (Fe0.8 Mo1.2) O6,0
Sr2 (Fe0.9 Mo1.1) O6,0
Sr2 (Fe0.95 Mo1.05) O6,0
Sr2 (Fe Mo) O6,0
Sr2 (Fe1.05 Mo0.95) O6,0
Sr2 (Fe1.1 Mo0.9) O6,0
Sr2 (Fe1.2 Mo0.8) O6,0
Sr2 (Fe1.3 Mo0.7) O6,0
(Na0.038 Li0.962) Fe (Si2 O6),0
(Na0.101 Li0.899) Fe (Si2 O6),0
(Na0.235 Li0.765) Fe (Si2 O6),0
(Na0.273 Li0.727) Fe (Si2 O6),0
(Na0.499 Li0.501) Fe (Si2 O6),0
(Na0.611 Li0.389) Fe (Si2 O6),0
Ca (Mn0.64 Fe0.13 Mg0.23) (C O3)2,0
(Co.334 Ni.333 Zn.333) (Si O3),0
Ba4 (Li1.6 U0.4) U2 O12,0
Ba2 Mg (Re O6),0
Ba1.93 Mg W0.95 O6,0
(La Sr) Zn Nb O6,0
(La Ba) Zn Ta O6,0
(Ba Sr) La Bi O6,0
(Nd0.5 Ca0.5) ((Mn0.99 Ru0.01) O3),0
Ba2 Na (Re O6),0
Ba2 Li (Re O6),0
Ba2 Ca (Re O6),0
Ba2 Cd (Re O6),0
Ba2 Mn (Re O6),0
Ba2 Zn (Re O6),0
Ba2 Co (Re O6),0
Ba2 Fe (Re O6),0
Nd Ba2 Nb O6,0
Ba2 Ni (Re O6),0
Sr2 (Ni W O6),0
In Ba2 Nb O6,0
Lu Ba2 Nb O6,0
Yb Ba2 Nb O6,0
Tm Ba2 Nb O6,0
Er Ba2 Nb O6,0
Ho Ba2 Nb O6,0
Dy Ba2 Nb O6,0
Gd Ba2 Nb O6,0
Eu Ba2 Nb O6,0
Sm Ba2 Nb O6,0
(Sr0.4 Ba0.6)2 Ca Mo O6,0
(Na0.89 Li0.11) Fe (Si2 O6),0
La Ba Co Ta O6,0
Sr2 (Cu Os O6),0
Ba2 (Nd Sb O6),0
Ba2 (Pr Sb O6),0
Ba2 (Eu Nb O6),0
(Ba1.2 Sr0.8) Er (Mo O6),0
(Ba1.5 Sr0.5) Er (Mo O6),0
Ba2 Er Sb O6,0
Ba2 Nd Sb O6,0
Ba2 Er Nb O6,0
Ba2 Tb Nb O6,0
Sr2 (Fe0.13 V0.11 Mo0.76) (Mo0.24 Fe0.76) O6,0
Sr2 (Fe0.12 Mo0.8 V0.083) (Mo0.2 Fe0.8) O6,0
Sr2 (Fe0.1 V0.045 Mo0.85) (Mo0.15 Fe0.85) O6,0
Sr2 (Fe0.044 V0.056 Mo0.9) (Mo0.1 Fe0.9) O6,0
Ba2 Ni U O6,0
Ba2 Co U O6,0
Ba2 Ni W O6,0
Ba2 (Zn0.25 Ni0.75) W O6,0
Ba2 (Zn0.5 Ni0.5) W O6,0
Ba2 (Zn0.75 Ni0.25) W O6,0
Ba2 Zn W O6,0
Ba La Ni Os O6,0
Ca Al (Al Si) O6,0
Sr2 Li (Re O6),0
Sr2 (Fe0.84 Mo0.16) (Fe0.49 Mo0.51) O6,0
Ba2 Ti Zr O6,0
Sr2 (Fe0.85 Mo1.15) (O0.889 N0.111)6,0
Cs2 U Si O6,0
Cs In (H P O3)2,0
Rb In (H P O3)2,0
Ag2 (Te2 O6),0
Pb2 Bi (V0.84 P0.16) O6,0
Ca La Fe Ni0.5 W0.5 O6,0
Sr La Fe Ni0.5 W0.5 O6,0
Ba2 Y Ta O6,0
Ca Mn Ge2 O6,0
Ba1.25 Pr0.75 Fe Mo O6,0
Ba1.5 Pr0.5 Fe Mo O6,0
Ba1.7 Pr0.3 Fe Mo O6,0
Ba1.8 Pr0.2 Fe Mo O6,0
Ba1.9 Pr0.1 Fe Mo O6,0
(Ca0.8 Mg0.2) (Mg0.76 Al0.09 Cr0.08 Fe0.07) Si2 O6,0
Ba2 Dy Sb O6,0
Ba2 Sc Ru O6,0
Ba2 Co Re O6,0
Ca (Mg0.5 Al0.5) (Al0.5 Si1.5 O6),0
Sr2 Fe Os O6,0
Gd (H2 O) (C4 O4)0.5 (H P O3),0
Eu (H2 O) (C4 O4)0.5 (H P O3),0
Bi Cu2 (V0.6 P0.4) O6,0
Sr2 (Ni0.71 Mg0.29) Mo O6,0
Ca Mn (C O3)2,0
Ba2 Co W O6,0
(Li0.5 Nd0.5) (Ti O3),0
Ba2 Yb Nb O6,0
(Sr1.9 K0.1) Fe Mo O6,0
(Sr1.92 K0.08) Fe Mo O6,0
(Sr1.94 K0.06) Fe Mo O6,0
(Sr1.96 K0.04) Fe Mo O6,0
Ca2 Ti Mn O6,0
Sr2 Cu Ir O6,0
Sr2 Co Nb O6,0
Ba2 Ho Ta O6,0
Y2 Mn Cr O6,0
Sr2 Sb Mn O6,0
Sr2 Cu W O6,0
Sr2 Co W O6,0
Sr2 Ni W O6,0
Sr2 Zr Ti O6,0
(Ba1.6 Sr0.4) Fe Mo O6,0
Ca1.11 Mn.89 (C O3)2,0
Li2 Zr Te O6,0
Ba2 Y Ru O6,0
Sr2 (Fe0.96 Mo1.04) O6,0
Sr2 (Fe0.87 Mo1.13) O6,0
Sr2 (Fe0.92 Mo1.08) O6,0
Ba2 Lu Ru O6,0
Na (Al Si2 O6),0
Ba2 (Fe W O6),0
Sr2 Ca W O6,0
(Sr1.90 Bi0.10) Mn Mo O6,0
(Sr1.92 Bi0.08) Mn Mo O6,0
(Sr1.94 Bi0.06) Mn Mo O6,0
(Sr1.95 Bi0.05) Mn Mo O6,0
(Sr1.98 Bi0.02) Mn Mo O6,0
Li2 Ti (Te O6),0
(Na0.818 Li0.182) Fe (Si2 O6),0
(Na0.948 Li0.052) Fe (Si2 O6),0
Ca Fe Ge2 O6,0
Cs (Al Si2 O6),0
Ba2 Fe U O6,0
Ba2 In Ru O6,0
(Ca Fe) (Si O3)2,0
Li Sr (Bi O3) (Te O3),0
Sr (Co0.67 Te0.33 O3),0
Ca Zn (C O3)2,0
Sr1.95 Fe Mo (O0.863 N0.137)6,0
Sr1.95 Fe Mo (O0.882 N0.118)6,0
Sr1.97 Fe Mo (O0.905 N0.095)6,0
Sr1.93 Fe Mo (O0.92 N0.08)6,0
Eu3 Ta O6,0
Ba (Fe0.47 Ho0.2 U0.33 O3),0
Ba (Fe0.54 Ho0.13 U0.33 O3),0
Ba (Fe0.6 Ho0.07 U0.33 O3),0
Ba (Fe0.67 U0.33 O3),0
Na1.048 Sc1.017 (Si2 O6),0
Ba3 Ir1.44 Fe1.56 O9,0
(Co1.26 Zn1.74) Te O6,0
Rb (Ga (H P O3)2),0
K (Ga (H P O3)2),0
Li V Si2 O6,0
Na Sc (Se O3)2,0
Hg Cu (Se O3)2,0
Cd Cu (Se O3)2,0
Ba2 Cr U O6,0
Ba1.2 Sr.8 Yb Re O6,0
Sr2 Yb Re O6,0
Sr2 Tm Re O6,0
Sr2 Er Re O6,0
Sr2 Y Re O6,0
Sr2 Ho Re O6,0
Sr2 Dy Re O6,0
Sr2 Tb Re O6,0
Sr2 Gd Re O6,0
Ba2 Yb Re O6,0
Ba2 Tm Re O6,0
Ba2 Ho Re O6,0
Ba2 Dy Re O6,0
Ba2 Tb Re O6,0
Ba2 Eu Re O6,0
Ba2 Sm Re O6,0
Ba2 La Re O6,0
Ba2 Ni Te O6,0
Ca Ba (C O3)2,0
Na In (Si O3)2,0
Ba2 Mg.5 Fe.667 U.833 O6,0
Ba2 Fe1.333 U.667 O6,0
Ba2 Mg U O6,0
Ba2 Mn U O6,0
Ca1.05 Mn.95 Si2 O6,0
Pb2 (B O3) (N O3),0
Mn2 Fe W O6,0
Hg2 Mo Te O6,0
La0.504 Li0.486 (Ti O3),0
Ca (Fe0.19 Zn0.81) Si2 O6,0
Ca (Fe0.52 Zn0.48) (Si2 O6),0
Cs Gd (C O3)2,0
Rb Sm (C O3)2,0
Cu Sr Te2 O6,0
K Dy (C O3)2,0
K Gd (C O3)2,0
K Nd (C O3)2,0
K Yb (C O3)2,0
K Ho (C O3)2,0
Pb2 Co (Te O6),0
(La0.272 Sr0.728) (Al0.648 Ta0.352) O3,0
Cs Pr (C O3)2,0
K B Si2 O6,0
(Na0.29 K0.71) (Nb O3),0
(Tb (C H O2) (C2 O4)),0
Na0.5 Bi0.5 Ti O3,0
Rb Y Te2 O6,0
K Y Te2 O6,0
Ca (Co0.17 Mg0.83) (C O3)2,0
Hg0.817 Re0.15 Ba2 Cu O6.29,0
Hg0.86 Re0.14 Ba2 Cu O5.62,0
Ba2 Lu Ta O6,0
Ba2 Li (Os O6),0
Ba2 Na (Os O6),0
(Ca0.19 Fe0.739 Mg1.036 Mn0.015 Ti0.01) (Si2 O6),0
Ca0.116 Fe0.66 Mg1.23 (Si2 O6),0
Hg2 Mo Se O6,0
Ni2 In Sb O6,0
Ag2 (V As O6),0
Na Tb (Si2 O6),0
Ba Pd (Se O3)2,0
K Fe (H P O3)2,0
Rb V (H P O3)2,0
Rb Fe (H P O3)2,0
K V (H P O3)2,0
Ca0.12 Fe0.85 Mg1.03 (Si2 O6),0
Na2 (Se Mo O6),0
Ca0.12 Fe0.73 Mg1.15 (Si2 O6),0
Ca0.12 Fe1.10 Mg0.78 (Si2 O6),0
Sr2 Na (Re O6),0
(Ca0.92 Fe0.08) (Fe0.16 Mg0.84) (Si2 O6),0
Ba Zn (Se O3)2,0
Rb2 (Se Mo O6),0
K2 (Se Mo O6),0
Ba1.6 Sr.4 Yb Re O6,0
Ba.8 Sr1.2 Yb Re O6,0
(Ba Pr) Li (Te O6),0
Sr2 Zn (W O6),0
Li2 Zr (Te O6),0
(Ca0.86 Mn0.14) (Ca0.14 Mn0.5 Fe0.13 Mg0.23) (C O3)2,0
(Ca0.82 Mn0.18) (Ca0.18 Mn0.46 Fe0.13 Mg0.23) (C O3)2,0
Ba La Li Te O6,0
Sr2 Tm (Nb O6),0
Ba2 Ca (W O6),0
(Sr La) Co Ta O6,0
(Sr1.1 La0.9) Co Ta O6,0
(Sr1.3 La0.7) Co Ta O6,0
(Sr1.4 La0.6) Co Ta O6,0
Ca Mg (Si O3)2,0
Ba2 Ca (Mo O6),0
Ce (C2 O4) (H C O2),0
Cs Li H2 (Se O3)2,0
Li2 Sn (Te O6),0
Ba2 Tb Sb O6,0
Ba2 Eu Sb O6,0
Ba2 Sm Sb O6,0
Sr2 Ca (Mo O6),0
Ba.4 Sr1.6 Yb Re O6,0
Ba Bi0.67 Ca0.33 O3,0
Ba2 (Ca0.785 Nb0.215) Nb O5.97 (D2 O)0.12,0
(Y0.6 Cu0.4) (Y0.2 Mo0.8) Ba2 O6,0
Sr2 Cr Mo O6,0
Pb (Sc0.5 Ta0.5) O3,0
Ba2 Cu (Te O6),0
Sr2 Cu (Te O6),0
Sr2 Cu (W O6),0
Ba2 Cu (W O6),0
(La Sr) ((Ni0.7 Cu0.3 Ta) O6),0
(La Sr) ((Ni0.9 Cu0.1 Ta) O6),0
(La Sr) ((Ni Ta) O6),0
Ba La Mn Ta O6,0
Ba (Zr0.25 (Zn0.333 Ta0.667)0.75 O3),0
Ba (Zr0.15 (Zn0.333 Ta0.667)0.85 O3),0
Ca2 Pd (W O6),0
Ca2 Fe (W O6),0
Ba2 Pr Pt O6,0
Sr2 Fe (W O6),0
Sr2 Mg (Ir O6),0
Ca (Mg0.69 Fe0.31) (Si2 O6),0
Pb2 (Sc Ta O6),0
Pr Ba2 Sb O6,0
Ni1.14 Pt2.86 O6,0
Mg Pt3 O6,0
Zn Pt3 O6,0
Co Pt3 O6,0
Ba8 Fe4.24 Lu1.068 U2.68 O24,0
Ba8 Fe4.8 Lu0.52 U2.68 O24,0
Ba8 Fe3.732 Y1.596 U2.668 O24,0
Ba7.996 Fe4.264 Y1.068 U2.668 O24,0
Ba7.996 Fe4.8 Y0.536 U2.668 O24,0
Ba8 Sc5.332 U2.668 O24,0
Ba8 Fe1.332 Sc4 U2.668 O24,0
Ba8 Fe2 Sc3.336 U2.668 O24,0
Ba8 Fe2.664 Sc2.668 U2.668 O24,0
Ba8 Fe3.732 Sc1.6 U2.664 O24,0
Ba8 Fe4 Sc1.332 U2.664 O24,0
Ba8 Fe4.264 Sc1.064 U2.664 O24,0
Ba8 Fe4.52 Sc0.8 U2.68 O24,0
Ba8 Fe4.788 Sc0.532 U2.68 O24,0
Ba8 Fe5.052 Sc0.268 U2.68 O24,0
Ba8 Fe5.32 U2.68 O24,0
Sr2 (Fe1.333 U0.667 O6),0
Ba (Fe0.6667 U0.3333 O3),0
Zn2 Mn (Si O4) (O H)2,0
Ba2 Ni (W O6),0
Sr Sn (B O3)2,0
Mg Sn (B O3)2,0
Ba4 Te2.4 Li1.6 O12,0
Ba2 (U Fe) O6,0
Ba2 In Ir O6,0
Ca Mn (Si2 O6),0
Ba8.04 Fe3.72 Lu1.56 U2.68 O24,0
Ba8.04 Fe3.2 Lu2.12 U2.68 O24,0
Ba7.972 Fe4.788 Tm0.56 U2.68 O24,0
Ba8 Fe0.668 In4.664 U2.668 O24,0
Mn Pt3 O6,0
Sr2 Cu Te O6,0
Sr2 Zn0.5 Cu0.5 W O6,0
Ba2 Zn0.8 Cu0.2 W O6,0
Ba2 Cu W O6,0
Ba3 Ti Ru2 O9,0
Sr (Co0.67 W0.33 O3),0
Ba8 In5.32 U2.68 O24,0
Ba8 Fe1.332 In4 U2.668 O24,0
Ba7.972 Fe4.252 Tm1.092 U2.68 O24,0
Ba8 Fe2 In3.332 U2.668 O24,0
Ba8 Fe2.668 In2.664 U2.668 O24,0
Ba8 Fe4 In1.332 U2.668 O24,0
Ba8 Fe4.268 In1.064 U2.668 O24,0
Ba8 Fe4.532 In0.8 U2.668 O24,0
Ba8 Fe4.8 In0.532 U2.668 O24,0
Ba8 Fe5.064 In0.268 U2.668 O24,0
Ba8 Fe3.72 Dy1.6 U2.68 O24,0
Ba8.028 Fe4.264 Dy1.04 U2.668 O24,0
